{
  "schemaVersion": "recording_presentation.v1",
  "recordingId": "00000000-0000-4000-8000-000000000001",
  "episodeId": "00000000-0000-4000-8000-000000000002",
  "clock": {
    "origin": "capture_ready",
    "timebase": "recording_relative_ms",
    "captureEpoch": 1,
    "originAuthorityId": "00000000-0000-4000-8000-000000000003",
    "durationMs": 5000
  },
  "sourceCursors": {
    "episodeControlStartRevision": 4,
    "episodeControlEndRevision": 5,
    "chatStartSequence": 0,
    "chatEndSequence": 1,
    "whiteboardStartRevision": 0,
    "whiteboardEndRevision": 0,
    "capturePlanStartRevision": 1,
    "capturePlanEndRevision": 2
  },
  "initial": {
    "elapsedMs": 0,
    "profile": {
      "name": "recording-space",
      "version": "1",
      "uiBuildSha256": "1111111111111111111111111111111111111111111111111111111111111111",
      "viewport": { "width": 1280, "height": 720, "deviceScaleFactor": 1 },
      "locale": "en",
      "timeZone": "UTC",
      "fontAssetIds": [],
      "theme": {
        "colorScheme": "light",
        "skin": "classic",
        "palette": "light",
        "texture": "none",
        "stageBackground": true,
        "generatedAvatars": true
      }
    },
    "space": { "id": "00000000-0000-4000-8000-000000000004", "name": "Shared Space" },
    "view": { "layout": "grid", "sidebar": "chat" },
    "participants": [
      {
        "id": "00000000-0000-4000-8000-000000000005",
        "displayName": "Sam",
        "joinOrdinal": 2,
        "joined": true,
        "microphoneMuted": false,
        "cameraEnabled": true,
        "screenShareEnabled": false,
        "speaking": false,
        "activeSpeaker": false,
        "handRaised": false
      }
    ],
    "media": [],
    "chat": { "retainedFloorSequence": null, "headSequence": 0, "messages": [] },
    "sharedContent": { "kind": "none" },
    "reactions": []
  },
  "events": [
    {
      "atMs": 1000,
      "sequence": 1,
      "kind": "chat_message_added",
      "message": {
        "id": "00000000-0000-4000-8000-000000000006",
        "sequence": 1,
        "participantId": "00000000-0000-4000-8000-000000000005",
        "displayName": "Sam",
        "text": "Hello",
        "createdAtMs": 1000,
        "displayTime": "00:01",
        "attachments": []
      }
    },
    {
      "atMs": 2000,
      "sequence": 2,
      "kind": "participant_hand_raised_changed",
      "participantId": "00000000-0000-4000-8000-000000000005",
      "raised": true
    }
  ],
  "assets": []
}
